{
    "$schema": "https://json-schema.org/draft/2020-12/schema",
    "$id": "https://schema.beckn.io/EnergyMeterDataCredential/v1.0/schema.json",
    "title": "Energy Meter Data Credential Schema",
    "description": "JSON Schema for the Meter Data Verifiable Credential. Uses ESPI/Green Button types (from https://naesb.org/espi.xsd) and numeric enum codes. Combines customer identity (customerProfile) with historical time-series interval meter readings (meterDataGB) within a W3C VC 2.0 envelope.",
    "type": "object",
    "required": ["@context", "id", "type", "issuer", "validFrom", "credentialSubject"],
    "properties": {
        "@context": {
            "type": "array",
            "items": { "type": "string" },
            "contains": { "const": "https://www.w3.org/ns/credentials/v2" },
            "minItems": 2
        },
        "id": {
            "type": "string",
            "format": "uri",
            "pattern": "^urn:uuid:[0-9a-f]{8}-[0-9a-f]{4}-[0-9a-f]{4}-[0-9a-f]{4}-[0-9a-f]{12}$"
        },
        "type": {
            "type": "array",
            "items": { "type": "string" },
            "contains": { "const": "EnergyMeterDataCredential" },
            "minItems": 2
        },
        "issuer": { "$ref": "#/$defs/Issuer" },
        "validFrom": { "type": "string", "format": "date-time" },
        "validUntil": { "type": "string", "format": "date-time" },
        "credentialStatus": { "$ref": "#/$defs/CredentialStatus" },
        "credentialSubject": {
            "type": "object",
            "required": ["customerProfile", "meterDataGB"],
            "properties": {
                "id": { "type": "string", "format": "uri" },
                "customerProfile": { "$ref": "#/$defs/CustomerProfile" },
                "meterDataGB": { "$ref": "#/$defs/MeterDataGB" }
            }
        },
        "proof": { "$ref": "#/$defs/Proof" }
    },
    "$defs": {
        "Issuer": {
            "type": "object",
            "required": ["id", "type", "name", "issuedBy", "subjectId"],
            "properties": {
                "id": { "type": "string", "format": "uri" },
                "type": { "type": "string", "const": "idRef" },
                "name": { "type": "string", "minLength": 1 },
                "issuedBy": { "type": "string", "format": "uri" },
                "subjectId": { "type": "string", "minLength": 1 }
            }
        },
        "CredentialStatus": {
            "type": "object",
            "required": ["id", "type", "statusPurpose"],
            "properties": {
                "id": { "type": "string", "format": "uri" },
                "type": { "type": "string", "const": "dedi" },
                "statusPurpose": { "type": "string", "enum": ["revocation", "suspension"] },
                "statusListCredential": { "type": "string", "format": "uri" }
            }
        },
        "Proof": {
            "type": "object",
            "required": ["type", "created", "verificationMethod", "proofPurpose", "proofValue"],
            "properties": {
                "type": { "type": "string" },
                "created": { "type": "string", "format": "date-time" },
                "verificationMethod": { "type": "string", "format": "uri" },
                "proofPurpose": { "type": "string", "enum": ["assertionMethod", "authentication"] },
                "proofValue": { "type": "string", "minLength": 1 }
            }
        },
        "CustomerProfile": {
            "type": "object",
            "description": "Shared customer identity from DEG CustomerProfile (PR #208). Terms resolve to deg: namespace.",
            "required": ["customerNumber", "meterNumber", "meterType"],
            "properties": {
                "customerNumber": { "type": "string", "minLength": 1, "description": "Utility account number (deg:customerNumber)" },
                "meterNumber": { "type": "string", "minLength": 1, "maxLength": 50, "description": "Meter serial number (deg:meterNumber)" },
                "meterType": {
                    "type": "string",
                    "enum": ["AMR", "AMI", "Electromechanical", "Forward", "Reverse", "Bidirectional", "Prepaid", "NetMeter", "Other"],
                    "description": "Meter type per DEG CustomerProfile enum (deg:meterType)"
                },
                "idRef": { "$ref": "#/$defs/IdRef" }
            }
        },
        "IdRef": {
            "type": "object",
            "description": "Reusable identity reference from DEG (deg:idRef). Links an authority DID to a subject identifier.",
            "required": ["issuedBy", "subjectId"],
            "properties": {
                "issuedBy": { "type": "string", "format": "uri", "description": "DID or URI of the issuing authority (deg:issuedBy)" },
                "subjectId": { "type": "string", "minLength": 1, "description": "Identifier within the authority's system (deg:subjectId)" }
            }
        },
        "DateTimeInterval": {
            "type": "object",
            "required": ["start", "duration"],
            "properties": {
                "start": { "type": "string", "format": "date-time" },
                "duration": { "type": "integer", "minimum": 0 }
            }
        },
        "ServiceCategory": {
            "type": "object",
            "required": ["kind"],
            "properties": {
                "kind": {
                    "oneOf": [
                        { "type": "integer", "enum": [0, 1, 2, 3, 4, 5, 6, 7, 8, 9] },
                        { "type": "string", "enum": ["electricity", "gas", "water", "time", "heat", "refuse", "sewerage", "rates", "tvLicense", "internet"] }
                    ],
                    "description": "ESPI ServiceKind. 0=electricity, 1=gas, 2=water, 3=time, 4=heat, 5=refuse, 6=sewerage, 7=rates, 8=tvLicense, 9=internet."
                }
            }
        },
        "QualityOfReading": {
            "oneOf": [
                { "type": "integer", "enum": [0, 7, 8, 9, 10, 11, 12, 13, 14, 15, 16, 17, 18, 19] },
                { "type": "string", "enum": ["valid", "manuallyEdited", "estimatedUsingReferenceDay", "estimatedUsingLinearInterpolation", "questionable", "derived", "projected", "mixed", "raw", "normalizedForWeather", "other", "validated", "verified", "billingApproved"] }
            ],
            "description": "ESPI QualityOfReading. 0=valid, 7=manuallyEdited, 8=estimatedUsingReferenceDay, 9=estimatedUsingLinearInterpolation, 10=questionable, 11=derived, 12=projected, 13=mixed, 14=raw, 15=normalizedForWeather, 16=other, 17=validated, 18=verified, 19=billingApproved."
        },
        "ReadingType": {
            "type": "object",
            "required": ["commodity", "flowDirection", "uom", "accumulationBehaviour", "intervalLength"],
            "properties": {
                "commodity": {
                    "oneOf": [
                        { "type": "integer", "enum": [0, 1, 2, 3, 4, 5, 6, 7, 8, 9, 10, 11] },
                        { "type": "string", "enum": ["none", "electricitySecondaryMetered", "electricityPrimaryMetered", "communication", "air", "insulativeGas", "insulativeOil", "naturalGas", "propane", "potableWater", "steam", "wasteWater"] }
                    ],
                    "description": "ESPI CommodityKind. 0=none, 1=electricitySecondaryMetered, 2=electricityPrimaryMetered, 7=naturalGas, 9=potableWater."
                },
                "flowDirection": {
                    "oneOf": [
                        { "type": "integer", "enum": [0, 1, 2, 3, 4, 5, 19, 20] },
                        { "type": "string", "enum": ["none", "forward", "lagging", "leading", "net", "q1plusQ2", "reverse", "total"] }
                    ],
                    "description": "ESPI FlowDirectionKind. 0=none, 1=forward, 4=net, 19=reverse, 20=total."
                },
                "uom": {
                    "oneOf": [
                        { "type": "integer", "enum": [5, 29, 31, 33, 38, 42, 61, 63, 72] },
                        { "type": "string", "enum": ["A", "V", "J", "Hz", "W", "m3", "VA", "VAr", "Wh"] }
                    ],
                    "description": "ESPI UnitSymbolKind. 5=A, 29=V, 31=J, 33=Hz, 38=W, 42=m3, 61=VA, 63=VAr, 72=Wh."
                },
                "powerOfTenMultiplier": {
                    "type": "integer",
                    "default": 0,
                    "description": "ESPI UnitMultiplierKind. 0=x1, 3=kilo, -3=milli, 6=mega, etc."
                },
                "accumulationBehaviour": {
                    "oneOf": [
                        { "type": "integer", "enum": [0, 1, 2, 3, 4, 6, 9, 10, 12, 13, 14] },
                        { "type": "string", "enum": ["none", "bulkQuantity", "continuousCumulative", "cumulative", "deltaData", "indicating", "summation", "timeDelay", "instantaneous", "latchingQuantity", "boundedQuantity"] }
                    ],
                    "description": "ESPI AccumulationBehaviourKind. 0=none, 4=deltaData, 12=instantaneous."
                },
                "intervalLength": {
                    "type": "integer",
                    "minimum": 1,
                    "description": "Standard interval length in seconds (e.g., 900 for 15 min)."
                },
                "currency": {
                    "oneOf": [
                        { "type": "integer", "enum": [0, 36, 124, 156, 208, 356, 392, 578, 643, 752, 756, 826, 840, 978] },
                        { "type": "string", "enum": ["other", "AUD", "CAD", "CNY", "DKK", "INR", "JPY", "NOK", "RUB", "SEK", "CHF", "GBP", "USD", "EUR"] }
                    ],
                    "description": "ISO 4217 numeric currency code. 840=USD, 978=EUR, 356=INR."
                },
                "kind": {
                    "oneOf": [
                        { "type": "integer" },
                        { "type": "string", "enum": ["none", "energy", "demand", "power", "current", "voltage", "frequency", "powerFactor", "apparentPowerFactor", "quantityPower", "volumetricFlow"] }
                    ],
                    "description": "ESPI MeasurementKind. 0=none, 12=energy, 37=power, 38=demand."
                },
                "phase": {
                    "oneOf": [
                        { "type": "integer", "enum": [0, 16, 32, 64, 128, 256, 512, 768] },
                        { "type": "string", "enum": ["notApplicable", "phaseAN", "phaseBN", "phaseCN", "phaseAB", "phaseBC", "phaseCA", "phaseABC"] }
                    ],
                    "description": "ESPI PhaseCodeKind. 0=N/A, 128=A, 64=B, 32=C, 768=ABC."
                },
                "dataQualifier": { "type": "integer", "description": "ESPI DataQualifierKind. 0=none, 2=average, 8=maximum, 9=minimum." },
                "defaultQuality": { "$ref": "#/$defs/QualityOfReading" },
                "timeAttribute": { "type": "integer", "description": "ESPI TimePeriodOfInterest." },
                "measuringPeriod": { "type": "integer", "description": "ESPI TimeAttributeKind." },
                "consumptionTier": { "type": "integer" },
                "tou": { "type": "integer" },
                "cpp": { "type": "integer" }
            }
        },
        "ReadingQuality": {
            "type": "object",
            "required": ["quality"],
            "properties": {
                "quality": { "$ref": "#/$defs/QualityOfReading" }
            }
        },
        "IntervalReading": {
            "type": "object",
            "required": ["timePeriod", "value"],
            "properties": {
                "timePeriod": { "$ref": "#/$defs/DateTimeInterval" },
                "value": { "type": "number", "description": "Reading value — integer (scaled by powerOfTenMultiplier) or decimal (direct physical quantity)." },
                "cost": {
                    "type": "number",
                    "description": "Cost for this interval. Integer = hundred-thousandths (1e-5) of currency (ESPI native). Float (has decimal point) = exact cost in currency unit."
                },
                "ReadingQuality": { "$ref": "#/$defs/ReadingQuality" },
                "consumptionTier": { "type": "integer" },
                "tou": { "type": "integer" },
                "cpp": { "type": "integer" }
            }
        },
        "IntervalBlock": {
            "type": "object",
            "required": ["interval", "IntervalReading"],
            "properties": {
                "interval": { "$ref": "#/$defs/DateTimeInterval" },
                "IntervalReading": {
                    "type": "array",
                    "minItems": 1,
                    "items": { "$ref": "#/$defs/IntervalReading" }
                }
            }
        },
        "MeterDataGB": {
            "type": "object",
            "description": "ESPI/Green Button meter reading data for a single meter.",
            "required": ["ServiceCategory", "timeZone", "ReadingType", "IntervalBlock"],
            "properties": {
                "ServiceCategory": { "$ref": "#/$defs/ServiceCategory" },
                "timeZone": {
                    "type": "string",
                    "description": "IANA time-zone identifier (e.g., Asia/Kolkata). Not an ESPI property.",
                    "examples": ["Asia/Kolkata", "America/New_York"]
                },
                "ReadingType": { "$ref": "#/$defs/ReadingType" },
                "qualityOfReading": { "$ref": "#/$defs/QualityOfReading" },
                "IntervalBlock": {
                    "type": "array",
                    "minItems": 1,
                    "items": { "$ref": "#/$defs/IntervalBlock" }
                }
            }
        }
    }
}
